{
  "abstractions": [
    {
      "description": "Bindings are modeled as opaque exact identities; context/state/question/policy/scope digest construction is not re-derived in TLA+.",
      "id": "OPAQUE_BINDING"
    },
    {
      "description": "RecognizedAuthorityBindings represents already-recognized exact-binding Authority facts shared by request registration and terminal submission. Concrete signatures, credentials, delegation mechanisms, federation proof material and their validation are external to Seed.",
      "id": "AUTHORITY_RECOGNITION_BOUNDARY"
    },
    {
      "description": "RecognizedTerminalCommitments abstracts validation that a previous_terminal_record_digest commits to a previously recognized terminal ResolutionRecord; predecessor object retention is not required.",
      "id": "TERMINAL_COMMITMENT_ORACLE"
    },
    {
      "description": "Conflict is environment state and may be observed only for a resolution_id with an already accepted terminal record; additional distinct valid terminal material changes the derived resolution to UNKNOWN without mutating accepted Seed state.",
      "id": "ENVIRONMENT_CONFLICT_STATE"
    }
  ],
  "claim_boundary": "The proof establishes behavioral equivalence between SeedResolution.tla and a standalone TLA+ projection generated from the exact machine-readable Seed model under ASET-SEED-CANON-TLA-PROJECTION-V5. The generated projection does not import or extend SeedResolution; the proof explicitly instantiates the independent projection onto the target state. Opaque Binding construction, concrete Authority-recognition evidence, terminal-commitment provenance, cryptographic primitives, implementation refinement, liveness and natural-language completeness remain outside this proof boundary. The deterministic generator remains part of the assurance trusted computing base.",
  "document_type": "aset-canon-tla-refinement",
  "excluded_claims": [
    "natural-language-text equivalence",
    "cryptographic digest correctness",
    "concrete Authority evidence or delegation-chain validation",
    "implementation refinement",
    "liveness",
    "formal proof of projection-generator correctness",
    "terminal-commitment provenance verification",
    "storage pruning/compaction refinement"
  ],
  "generated_projection": {
    "generator": "tools/generate_canon_tla_projection.py",
    "module": "SeedCanonProjection",
    "path": "seed/canonical/formal/SeedCanonProjection.tla",
    "profile": "ASET-SEED-CANON-TLA-PROJECTION-V5"
  },
  "invariant_coverage": [
    {
      "id": "SEED-INV-001",
      "status": "PROVED_IN_DECLARED_PROJECTION"
    },
    {
      "id": "SEED-INV-002",
      "status": "PROVED_IN_DECLARED_PROJECTION"
    },
    {
      "id": "SEED-INV-003",
      "status": "PROVED_IN_DECLARED_PROJECTION"
    },
    {
      "id": "SEED-INV-004",
      "status": "PARTIAL_OPAQUE_BINDING"
    },
    {
      "id": "SEED-INV-005",
      "status": "PARTIAL_AUTHORITY_ABSTRACTION"
    },
    {
      "id": "SEED-INV-006",
      "status": "ABSTRACTED_AUTHORITY_RECOGNITION"
    },
    {
      "id": "SEED-INV-007",
      "status": "STRUCTURAL_BOUNDARY_OUTSIDE_STATE_MACHINE"
    },
    {
      "id": "SEED-INV-008",
      "status": "PROVED_IN_DECLARED_PROJECTION"
    },
    {
      "id": "SEED-INV-009",
      "status": "PARTIAL_EXTERNAL_MATERIAL_BOUNDARY"
    },
    {
      "id": "SEED-INV-010",
      "status": "PARTIAL_NO_CONTENT_ADDRESS_PROOF"
    },
    {
      "id": "SEED-INV-011",
      "status": "PROVED_IN_DECLARED_PROJECTION"
    },
    {
      "id": "SEED-INV-012",
      "status": "PARTIAL_TERMINAL_COMMITMENT_ABSTRACTION"
    }
  ],
  "operation_coverage": [
    {
      "id": "SEED-OP-001",
      "kind": "REGISTER_REQUEST",
      "status": "PROVED_IN_DECLARED_PROJECTION",
      "tla_action": "RegisterRequest"
    },
    {
      "id": "SEED-OP-002",
      "kind": "SUBMIT_RESOLUTION",
      "status": "PROVED_IN_DECLARED_PROJECTION",
      "tla_action": "SubmitResolution"
    },
    {
      "id": "SEED-OP-003",
      "kind": "EVALUATE_RESOLUTION",
      "status": "OBSERVER_EQUIVALENCE_PROVED",
      "tla_action": "EvaluateResolution"
    }
  ],
  "proof": {
    "final_theorem": "SeedResolutionBehaviorallyEquivalentToCanonProjection",
    "module": "seed/canonical/formal/SeedCanonRefinementProofs.tla",
    "verification_method": "ASET-VERIFY-CANON-TLA-REFINEMENT"
  },
  "relation_type": "STANDALONE_GENERATED_PROJECTION_WITH_BEHAVIORAL_EQUIVALENCE_PROOF",
  "requirement_coverage": [
    {
      "id": "ASET-SEED-REQ-001",
      "predicate": "binding_exact",
      "status": "PARTIAL_OPAQUE_BINDING"
    },
    {
      "id": "ASET-SEED-REQ-002",
      "predicate": "request_fresh",
      "status": "PROVED_IN_DECLARED_PROJECTION"
    },
    {
      "id": "ASET-SEED-REQ-003",
      "predicate": "resolution_domain",
      "status": "PROVED_IN_DECLARED_PROJECTION"
    },
    {
      "id": "ASET-SEED-REQ-004",
      "predicate": "allow_only",
      "status": "PROVED_IN_DECLARED_PROJECTION"
    },
    {
      "id": "ASET-SEED-REQ-005",
      "predicate": "fail_closed",
      "status": "PARTIAL_EXTERNAL_MATERIAL_BOUNDARY"
    },
    {
      "id": "ASET-SEED-REQ-006",
      "predicate": "local_authority",
      "status": "PARTIAL_AUTHORITY_ABSTRACTION"
    },
    {
      "id": "ASET-SEED-REQ-007",
      "predicate": "authority_recognition_boundary",
      "status": "ABSTRACTED_AUTHORITY_RECOGNITION"
    },
    {
      "id": "ASET-SEED-REQ-008",
      "predicate": "inputs_non_authoritative",
      "status": "STRUCTURAL_BOUNDARY_OUTSIDE_STATE_MACHINE"
    },
    {
      "id": "ASET-SEED-REQ-009",
      "predicate": "accepted_terminal_unique",
      "status": "PROVED_IN_DECLARED_PROJECTION"
    },
    {
      "id": "ASET-SEED-REQ-010",
      "predicate": "record_immutable",
      "status": "PARTIAL_NO_CONTENT_ADDRESS_PROOF"
    },
    {
      "id": "ASET-SEED-REQ-011",
      "predicate": "reconsider_fresh",
      "status": "PARTIAL_TERMINAL_COMMITMENT_ABSTRACTION"
    },
    {
      "id": "ASET-SEED-REQ-012",
      "predicate": "implementation_neutral",
      "status": "META_OUTSIDE_BEHAVIORAL_MODEL"
    }
  ],
  "resolution_algebra_fields": [
    "values",
    "derived",
    "stored_terminal",
    "effect_permitted_if",
    "fail_closed_values",
    "conflict_result",
    "unknown_semantics"
  ],
  "schema_version": 1,
  "scope": "DECLARED_CANONICAL_SAFETY_PROJECTION",
  "source_model": {
    "model_id": "ASET-SEED-RESOLUTION-CANON-0.3-ALPHA1",
    "path": "seed/canonical/source/seed-model.json",
    "sha256": "sha256:1fed5dc95045a287b3e9b8b4ea011a7b977729158f3360ed9a8a7e7e6ba1b4b0",
    "version": "0.3.0-alpha.1"
  },
  "target_model": {
    "module": "SeedResolution",
    "path": "seed/canonical/formal/SeedResolution.tla",
    "sha256": "sha256:1c0ebb27ed52da289f0981dcb11b61b6a7fc5c4a030ba434ae0b1d53b286b926"
  }
}
